{
  "estado": "ativo",
  "payload_hash": "sha256:3b84ef0c3afdffa437aa57f4f137a6fcf9b72c8eeb13bea64c36b95122180124",
  "validation_code": "NDF-U4VLRV7X7K2OL7P3WQOT",
  "assinaturas": [
    {
      "assinatura_id": "b45dd870-530e-49b1-b590-f6dcfd514584",
      "nivel": "avancada",
      "papel": "autor",
      "signatario": {
        "nome": "Rui Martins",
        "certificado_serie": "2b3c4d5e6f7a8b9c",
        "cargo": "Jurista"
      },
      "cades_b_lta": "<BASE64_DER_CADES_B_LTA_PLACEHOLDER — exemplo ilustrativo, não é uma assinatura CAdES real>",
      "assinado_em": "2026-06-14T10:00:00Z",
      "timestamps": {
        "assinatura": "<BASE64_RFC3161_TIMESTAMP_B_T_PLACEHOLDER>",
        "arquivo": "<BASE64_RFC3161_TIMESTAMP_B_LTA_PLACEHOLDER>"
      },
      "validation_material": {
        "cadeia_certificados": [
          "<BASE64_DER_CERT_SIGNATARIO_PLACEHOLDER>",
          "<BASE64_DER_CERT_RAIZ_PLACEHOLDER>"
        ]
      }
    }
  ]
}
