{
  "estado": "ativo",
  "payload_hash": "sha256:35be71e428b7549a3b270d79bdee93d8a1cc0cac51d64afd9a9e1c4a8f8d5a17",
  "validation_code": "NDF-BCEF5RCY4A4U24PPN4DT",
  "assinaturas": [
    {
      "assinatura_id": "b64a1975-0010-4674-a894-0cc5afb025a1",
      "nivel": "avancada",
      "papel": "autor",
      "signatario": {
        "nome": "Marta Oliveira",
        "certificado_serie": "1a2b3c4d5e6f7a8b",
        "cargo": "Técnica Superior"
      },
      "cades_b_lta": "<BASE64_DER_CADES_B_LTA_PLACEHOLDER — exemplo ilustrativo, não é uma assinatura CAdES real>",
      "assinado_em": "2026-06-10T15:00:00Z",
      "timestamps": {
        "assinatura": "<BASE64_RFC3161_TIMESTAMP_B_T_PLACEHOLDER>",
        "arquivo": "<BASE64_RFC3161_TIMESTAMP_B_LTA_PLACEHOLDER>"
      },
      "validation_material": {
        "cadeia_certificados": [
          "<BASE64_DER_CERT_SIGNATARIO_PLACEHOLDER>",
          "<BASE64_DER_CERT_RAIZ_PLACEHOLDER>"
        ]
      }
    }
  ]
}
