{
  "estado": "ativo",
  "payload_hash": "sha256:04ad1bc57f884634b918f230c5a461fa336b7837bf4b451555ba59c7aaf26274",
  "validation_code": "NDF-SMQOARVYN6KONWSGRKDC",
  "assinaturas": [
    {
      "assinatura_id": "d0276338-2d9b-4618-8b88-19178f26c16e",
      "nivel": "qualificada",
      "papel": "decisor",
      "ordem": 1,
      "signatario": {
        "nome": "Ana Ferreira",
        "certificado_serie": "3c4d5e6f7a8b9c0d",
        "cargo": "Subdirectora-Geral"
      },
      "cades_b_lta": "<BASE64_DER_CADES_B_LTA_PLACEHOLDER — exemplo ilustrativo, não é uma assinatura CAdES real>",
      "assinado_em": "2026-06-18T10:30:00Z",
      "timestamps": {
        "assinatura": "<BASE64_RFC3161_TIMESTAMP_B_T_PLACEHOLDER>",
        "arquivo": "<BASE64_RFC3161_TIMESTAMP_B_LTA_PLACEHOLDER>"
      },
      "validation_material": {
        "cadeia_certificados": [
          "<BASE64_DER_CERT_SIGNATARIO_PLACEHOLDER>",
          "<BASE64_DER_CERT_RAIZ_PLACEHOLDER>"
        ]
      }
    },
    {
      "assinatura_id": "e1387449-3eac-4729-9c99-2a289037d27f",
      "nivel": "selo_institucional",
      "papel": "selante",
      "ordem": 2,
      "cades_b_lta": "<BASE64_DER_CADES_B_LTA_PLACEHOLDER — selo institucional, exemplo ilustrativo>",
      "assinado_em": "2026-06-18T10:31:00Z",
      "timestamps": {
        "assinatura": "<BASE64_RFC3161_TIMESTAMP_B_T_PLACEHOLDER>",
        "arquivo": "<BASE64_RFC3161_TIMESTAMP_B_LTA_PLACEHOLDER>"
      },
      "validation_material": {
        "cadeia_certificados": [
          "<BASE64_DER_CERT_SELO_INSTITUCIONAL_PLACEHOLDER>",
          "<BASE64_DER_CERT_RAIZ_PLACEHOLDER>"
        ]
      }
    }
  ]
}
